{
  "metadata": {
    "title": "OpenClaw-RL: Train Any Agent Simply by Talking",
    "authors": [
      "Yinjie Wang",
      "Xuyang Chen",
      "Xiaolong Jin",
      "Mengdi Wang",
      "Ling Yang"
    ],
    "venue": "arXiv",
    "year": 2026,
    "doi_or_url": "https://arxiv.org/abs/2603.10165v1",
    "source_type": "pdf",
    "parsed_from": "local-pdf:/Users/liyao/Desktop/schedule/OpenClaw-RL- Train Any Agent Simply by Talking.pdf",
    "ingestion_timestamp": "2026-03-24T00:00:00Z",
    "arxiv_id": "2603.10165",
    "version": "v1"
  },
  "quick_pass": {
    "paper_type": "empirical",
    "problem_statement": "The paper addresses how deployed agents can learn continuously from the next-state signals they already generate during use, instead of discarding those signals or relying only on offline datasets and terminal outcome rewards.",
    "claimed_contributions": [
      "Introduces OpenClaw-RL, a unified framework that recovers next-state signals as a live online learning source for both personal and general agents.",
      "Separates next-state information into evaluative signals for scalar process rewards and directive signals for token-level corrective supervision.",
      "Proposes Hindsight-Guided On-Policy Distillation (OPD) to convert directive next-state information into token-level advantage supervision.",
      "Builds a fully decoupled asynchronous infrastructure that allows policy serving, environment hosting, reward judging, and training to run in parallel.",
      "Reports positive results across personal-agent personalization and general-agent RL settings including terminal, GUI, SWE, and tool-call tasks."
    ],
    "approach_summary": "OpenClaw-RL treats the next state after each agent action as the core learning signal. It scores evaluative next-state signals with a PRM judge for Binary RL, extracts concise hindsight hints from directive signals for OPD, and trains a single policy through an asynchronous infrastructure spanning multiple agent environments and interaction types.",
    "primary_comparators": [
      "Binary RL alone",
      "OPD alone",
      "combined Binary RL + OPD",
      "outcome-only rewards for general-agent RL"
    ],
    "credibility_signals": [
      "The paper gives a unified formalization of interaction streams and next-state-based reward learning.",
      "It includes infrastructure diagrams, algorithm pseudocode, judge prompt templates, and a hyperparameter appendix.",
      "It evaluates both personal-agent and general-agent settings instead of only a single toy environment.",
      "The experiments distinguish complementary method variants rather than presenting only one aggregate result."
    ],
    "uncertainty_flags": [
      "Several experiments rely on simulation or benchmark-specific settings, so real-world robustness beyond the reported environments remains uncertain.",
      "The paper argues broad framework generality, but the strongest evidence is still concentrated in the reported settings and model stack.",
      "Some quality judgments depend on PRM prompts, judge design, and next-state formatting choices that could materially affect results."
    ],
    "worth_deep_reading": true,
    "why_read_or_skip": "Worth a deep read if you care about agent learning from live interaction traces, RL infrastructure, or how to use rich next-state feedback rather than just final outcomes. It is especially relevant as a Layer 1 anchor for the agent-training level of the stack."
  },
  "method_card": {
    "task_definition": "Train deployed agents directly from live next-state signals across heterogeneous interaction settings such as personal conversations, terminal use, GUI interaction, software engineering, and tool-call traces.",
    "input_output_form": "Input: interaction streams containing states, actions, and subsequent next-state feedback from users or environments. Output: an updated policy that learns from evaluative scalar rewards and directive token-level corrective signals while continuing to serve requests online.",
    "core_components": [
      {
        "name": "Next-state signal extraction",
        "role": "Treat the first message or environment feedback after an action as the next-state signal that carries evaluative or directive information.",
        "locator": "p3-p5"
      },
      {
        "name": "Asynchronous four-component infrastructure",
        "role": "Decouple policy serving, environment hosting, reward judging, and policy training so learning can proceed online without blocking inference.",
        "locator": "p1 Figure 1; p5 Section 3.1"
      },
      {
        "name": "Binary RL with PRM judging",
        "role": "Convert evaluative next-state signals into scalar process rewards via judge voting and optimize the policy with a PPO-style objective.",
        "locator": "p6-p7 Section 4.1; p18 Appendix A"
      },
      {
        "name": "Hindsight-Guided On-Policy Distillation",
        "role": "Extract concise corrective hints from directive next-state signals and turn them into token-level teacher supervision via an enhanced-context teacher query.",
        "locator": "p7-p8 Section 4.2; p18 Appendix A"
      },
      {
        "name": "Step-wise reward integration for general agents",
        "role": "Combine outcome and process rewards for long-horizon agentic RL settings where terminal reward alone is too sparse.",
        "locator": "p9 Section 4.4"
      }
    ],
    "training_or_optimization_setup": "The policy receives interaction streams online. Binary RL uses a PRM judge and PPO-style clipped objective with KL regularization. OPD queries the same model under a hint-enhanced context and computes token-level advantage from the teacher-student log-prob gap. The paper uses a decoupled asynchronous runtime so rollout, reward judging, and training can run concurrently, with hyperparameters summarized in Appendix D.",
    "key_assumptions": [
      "Next-state signals encode useful evaluative or directive information about the preceding action.",
      "A shared policy can learn from heterogeneous next-state sources across multiple agent settings.",
      "Directive feedback can be distilled into concise hints that improve token-level supervision quality.",
      "Continuous online training can be made practical if serving and training are sufficiently decoupled."
    ],
    "novel_elements": [
      "Using next-state signals as the unifying live online learning source across both personal and general agents.",
      "Introducing OPD to convert directive next-state feedback into token-level on-policy distillation.",
      "Building a single asynchronous infrastructure that supports both personal-agent personalization and scalable general-agent RL.",
      "Integrating process and outcome rewards in a next-state-centric framework for long-horizon agents."
    ]
  },
  "experiment_card": {
    "datasets_or_benchmarks": [
      "GSM8K-derived homework simulation for student and teacher personal-agent settings",
      "SETA RL data for terminal agents",
      "OSWorld-Verified for GUI agents",
      "SWE-Bench-Verified for SWE agents",
      "DAPO RL data for tool-call agents",
      "AIME 2024 for tool-call evaluation mentioned in the setup"
    ],
    "evaluation_metrics": [
      "personalization score in the personal-agent track",
      "average rollout-task accuracy for terminal and SWE agents",
      "setting-specific accuracy for GUI and tool-call agents"
    ],
    "baselines": [
      "Binary RL",
      "OPD",
      "Combined Binary RL + OPD",
      "outcome-only reward optimization"
    ],
    "main_results": [
      {
        "result": "In the personal-agent track, the combined method substantially outperforms Binary RL and OPD alone after 8 and 16 update steps.",
        "locator": "p11, Table 3"
      },
      {
        "result": "The paper reports that OpenClaw can achieve visibly improved personalization in the student and teacher settings after dozens of interactions rather than requiring a separate offline data-collection phase.",
        "locator": "p11, Takeaways Q1 and Q2; Figure 2"
      },
      {
        "result": "The framework supports scalable RL across terminal, GUI, SWE, and tool-call settings, with accuracy curves shown for each domain.",
        "locator": "p12, Figure 4"
      },
      {
        "result": "Integrating outcome and process rewards improves over outcome-only optimization in tool-call and GUI settings in the reported table.",
        "locator": "p12, Table 4"
      },
      {
        "result": "The paper argues that the same infrastructure can scale from personal single-user deployment to cloud-hosted large-scale general-agent RL.",
        "locator": "p6 Section 3.3; p12"
      }
    ],
    "ablations": [
      "A direct method comparison is provided among Binary RL, OPD, and Combined training in the personal-agent track.",
      "General-agent experiments compare integrated process-plus-outcome rewards against outcome-only optimization."
    ],
    "sensitivity_studies": [
      "The paper discusses when OPD is beneficial: settings with rich directive content rather than merely evaluative feedback.",
      "Hyperparameter differences across GUI, SWE, terminal, and tool-call settings are exposed in Appendix D."
    ],
    "result_interpretation": "The visible evidence supports the claim that next-state signals are useful training signals and that combining coarse evaluative reward with richer directive supervision is often better than using either alone. The strongest support is for framework viability and positive learning trends, while broader claims about generality beyond the reported stack should still be read cautiously."
  },
  "claim_evidence_table": [
    {
      "claim_id": "C1",
      "claim_text": "Next-state signals can serve as a live online learning source across heterogeneous agent interaction types.",
      "claim_type": "methodological",